{
  "$schema": "http://json-schema.org/draft-07/schema",
  "$id": "https://causal-knowledge-base-editor.aig.fernuni-hagen.de/graphical-causal-knowledge-base-v1.schema.json",
  "$defs": {
    "id": {
      "type": "integer",
      "minimum": 0,
      "maximum": 9007199254740991
    },
    "position": {
      "type": "object",
      "additionalProperties": false,
      "required": ["x", "y"],
      "properties": {
        "x": {
          "type": "number"
        },
        "y": {
          "type": "number"
        }
      }
    },
    "atom": {
      "type": "object",
      "additionalProperties": false,
      "required": ["id", "name", "description", "position"],
      "properties": {
        "id": {
          "$ref": "#/$defs/id"
        },
        "name": {
          "type": "string"
        },
        "description": {
          "type": "string"
        },
        "assumption": {
          "enum": [1, 2, 3, 4, 5]
        },
        "position": {
          "$ref": "#/$defs/position"
        }
      }
    },
    "conjunction": {
      "type": "object",
      "additionalProperties": false,
      "required": ["id", "type", "position"],
      "properties": {
        "id": {
          "$ref": "#/$defs/id"
        },
        "type": { "const": "conjunction" },
        "position": {
          "$ref": "#/$defs/position"
        }
      }
    },
    "connectionId": {
      "type": "object",
      "additionalProperties": false,
      "required": ["sourceId", "targetId"],
      "properties": {
        "sourceId": {
          "$ref": "#/$defs/id"
        },
        "targetId": {
          "$ref": "#/$defs/id"
        }
      }
    },
    "connection": {
      "type": "object",
      "additionalProperties": false,
      "required": ["id", "negated"],
      "properties": {
        "id": {
          "$ref": "#/$defs/connectionId"
        },
        "negated": {
          "type": "boolean"
        }
      }
    }
  },
  "title": "Graphical causal knowledge base",
  "description": "Graphcial represenation of causal knowledge base.",
  "type": "object",
  "additionalProperties": false,
  "required": ["apiVersion", "atoms", "operators", "connections"],
  "properties": {
    "apiVersion": {
      "const": "graphical/v1"
    },
    "atoms": {
      "type": "array",
      "items": {
        "$ref": "#/$defs/atom"
      }
    },
    "operators": {
      "type": "array",
      "items": {
        "$ref": "#/$defs/conjunction"
      }
    },
    "connections": {
      "type": "array",
      "items": {
        "$ref": "#/$defs/connection"
      }
    }
  }
}
