{
  "apiVersion": "graphical/v1",
  "atoms": [
    {
      "id": 0,
      "name": "at-risk",
      "description": "",
      "assumption": 3,
      "position": {
        "x": 320,
        "y": 387
      }
    },
    {
      "id": 2,
      "name": "corona",
      "description": "",
      "assumption": 3,
      "position": {
        "x": 521,
        "y": 392
      }
    },
    {
      "id": 4,
      "name": "influenza",
      "description": "",
      "assumption": 3,
      "position": {
        "x": 782,
        "y": 385
      }
    },
    {
      "id": 6,
      "name": "covid",
      "description": "",
      "position": {
        "x": 552,
        "y": 639
      }
    },
    {
      "id": 8,
      "name": "flue",
      "description": "",
      "position": {
        "x": 742,
        "y": 643
      }
    },
    {
      "id": 10,
      "name": "fever",
      "description": "",
      "position": {
        "x": 663,
        "y": 881
      }
    },
    {
      "id": 12,
      "name": "chills",
      "description": "",
      "position": {
        "x": 618,
        "y": 1076
      }
    },
    {
      "id": 14,
      "name": "short-of-breath",
      "description": "",
      "position": {
        "x": 318,
        "y": 1023
      }
    }
  ],
  "operators": [
    {
      "id": 1,
      "type": "conjunction",
      "position": {
        "x": 320,
        "y": 359
      }
    },
    {
      "id": 3,
      "type": "conjunction",
      "position": {
        "x": 521,
        "y": 364
      }
    },
    {
      "id": 5,
      "type": "conjunction",
      "position": {
        "x": 782,
        "y": 357
      }
    },
    {
      "id": 7,
      "type": "conjunction",
      "position": {
        "x": 520,
        "y": 611
      }
    },
    {
      "id": 9,
      "type": "conjunction",
      "position": {
        "x": 710,
        "y": 615
      }
    },
    {
      "id": 11,
      "type": "conjunction",
      "position": {
        "x": 599,
        "y": 853
      }
    },
    {
      "id": 13,
      "type": "conjunction",
      "position": {
        "x": 586,
        "y": 1048
      }
    },
    {
      "id": 15,
      "type": "conjunction",
      "position": {
        "x": 286,
        "y": 995
      }
    },
    {
      "id": 16,
      "type": "conjunction",
      "position": {
        "x": 650,
        "y": 1048
      }
    },
    {
      "id": 17,
      "type": "conjunction",
      "position": {
        "x": 663,
        "y": 853
      }
    },
    {
      "id": 18,
      "type": "conjunction",
      "position": {
        "x": 727,
        "y": 853
      }
    },
    {
      "id": 19,
      "type": "conjunction",
      "position": {
        "x": 774,
        "y": 615
      }
    },
    {
      "id": 20,
      "type": "conjunction",
      "position": {
        "x": 584,
        "y": 611
      }
    },
    {
      "id": 21,
      "type": "conjunction",
      "position": {
        "x": 350,
        "y": 995
      }
    }
  ],
  "connections": [
    {
      "id": {
        "sourceId": 1,
        "targetId": 0
      },
      "negated": false
    },
    {
      "id": {
        "sourceId": 3,
        "targetId": 2
      },
      "negated": false
    },
    {
      "id": {
        "sourceId": 5,
        "targetId": 4
      },
      "negated": false
    },
    {
      "id": {
        "sourceId": 7,
        "targetId": 6
      },
      "negated": false
    },
    {
      "id": {
        "sourceId": 9,
        "targetId": 8
      },
      "negated": false
    },
    {
      "id": {
        "sourceId": 11,
        "targetId": 10
      },
      "negated": false
    },
    {
      "id": {
        "sourceId": 13,
        "targetId": 12
      },
      "negated": false
    },
    {
      "id": {
        "sourceId": 15,
        "targetId": 14
      },
      "negated": false
    },
    {
      "id": {
        "sourceId": 10,
        "targetId": 13
      },
      "negated": false
    },
    {
      "id": {
        "sourceId": 16,
        "targetId": 12
      },
      "negated": false
    },
    {
      "id": {
        "sourceId": 6,
        "targetId": 11
      },
      "negated": false
    },
    {
      "id": {
        "sourceId": 17,
        "targetId": 10
      },
      "negated": false
    },
    {
      "id": {
        "sourceId": 8,
        "targetId": 17
      },
      "negated": false
    },
    {
      "id": {
        "sourceId": 18,
        "targetId": 10
      },
      "negated": false
    },
    {
      "id": {
        "sourceId": 4,
        "targetId": 9
      },
      "negated": false
    },
    {
      "id": {
        "sourceId": 19,
        "targetId": 8
      },
      "negated": false
    },
    {
      "id": {
        "sourceId": 2,
        "targetId": 7
      },
      "negated": false
    },
    {
      "id": {
        "sourceId": 20,
        "targetId": 6
      },
      "negated": false
    },
    {
      "id": {
        "sourceId": 6,
        "targetId": 15
      },
      "negated": false
    },
    {
      "id": {
        "sourceId": 21,
        "targetId": 14
      },
      "negated": false
    },
    {
      "id": {
        "sourceId": 0,
        "targetId": 15
      },
      "negated": false
    }
  ]
}
