{
  "apiVersion": "graphical/v1",
  "atoms": [
    {
      "id": 0,
      "name": "giant-wave",
      "description": "The victim has encountered a giant wave.",
      "assumption": 3,
      "position": {
        "x": 400,
        "y": 100
      }
    },
    {
      "id": 1,
      "name": "strong-current",
      "description": "The victim has encountered a strong current.",
      "assumption": 3,
      "position": {
        "x": 600,
        "y": 100
      }
    },
    {
      "id": 2,
      "name": "jellyfish",
      "description": "The victim has been stung by a jellyfish.",
      "assumption": 3,
      "position": {
        "x": 800,
        "y": 100
      }
    },
    {
      "id": 3,
      "name": "broken-board",
      "description": "The victim's surfboard has been broken.",
      "position": {
        "x": 300,
        "y": 300
      }
    },
    {
      "id": 4,
      "name": "submersion",
      "description": "The victim has been submerged in water.",
      "position": {
        "x": 500,
        "y": 300
      }
    },
    {
      "id": 5,
      "name": "cramp",
      "description": "The victim has had a cramp.",
      "position": {
        "x": 732,
        "y": 300
      }
    },
    {
      "id": 6,
      "name": "drowning",
      "description": "The victim has drowned.",
      "position": {
        "x": 632,
        "y": 500
      }
    }
  ],
  "operators": [
    {
      "id": 7,
      "type": "conjunction",
      "position": {
        "x": 400,
        "y": 72
      }
    },
    {
      "id": 8,
      "type": "conjunction",
      "position": {
        "x": 600,
        "y": 72
      }
    },
    {
      "id": 9,
      "type": "conjunction",
      "position": {
        "x": 800,
        "y": 72
      }
    },
    {
      "id": 10,
      "type": "conjunction",
      "position": {
        "x": 268,
        "y": 272
      }
    },
    {
      "id": 11,
      "type": "conjunction",
      "position": {
        "x": 468,
        "y": 272
      }
    },
    {
      "id": 12,
      "type": "conjunction",
      "position": {
        "x": 668,
        "y": 272
      }
    },
    {
      "id": 13,
      "type": "conjunction",
      "position": {
        "x": 568,
        "y": 472
      }
    },
    {
      "id": 14,
      "type": "conjunction",
      "position": {
        "x": 632,
        "y": 472
      }
    },
    {
      "id": 15,
      "type": "conjunction",
      "position": {
        "x": 696,
        "y": 472
      }
    },
    {
      "id": 16,
      "type": "conjunction",
      "position": {
        "x": 332,
        "y": 272
      }
    },
    {
      "id": 17,
      "type": "conjunction",
      "position": {
        "x": 532,
        "y": 272
      }
    },
    {
      "id": 18,
      "type": "conjunction",
      "position": {
        "x": 732,
        "y": 272
      }
    },
    {
      "id": 19,
      "type": "conjunction",
      "position": {
        "x": 796,
        "y": 272
      }
    }
  ],
  "connections": [
    {
      "id": {
        "sourceId": 7,
        "targetId": 0
      },
      "negated": false
    },
    {
      "id": {
        "sourceId": 8,
        "targetId": 1
      },
      "negated": false
    },
    {
      "id": {
        "sourceId": 9,
        "targetId": 2
      },
      "negated": false
    },
    {
      "id": {
        "sourceId": 10,
        "targetId": 3
      },
      "negated": false
    },
    {
      "id": {
        "sourceId": 11,
        "targetId": 4
      },
      "negated": false
    },
    {
      "id": {
        "sourceId": 12,
        "targetId": 5
      },
      "negated": false
    },
    {
      "id": {
        "sourceId": 13,
        "targetId": 6
      },
      "negated": false
    },
    {
      "id": {
        "sourceId": 4,
        "targetId": 13
      },
      "negated": false
    },
    {
      "id": {
        "sourceId": 14,
        "targetId": 6
      },
      "negated": false
    },
    {
      "id": {
        "sourceId": 5,
        "targetId": 14
      },
      "negated": false
    },
    {
      "id": {
        "sourceId": 15,
        "targetId": 6
      },
      "negated": false
    },
    {
      "id": {
        "sourceId": 0,
        "targetId": 10
      },
      "negated": false
    },
    {
      "id": {
        "sourceId": 16,
        "targetId": 3
      },
      "negated": false
    },
    {
      "id": {
        "sourceId": 0,
        "targetId": 11
      },
      "negated": false
    },
    {
      "id": {
        "sourceId": 17,
        "targetId": 4
      },
      "negated": false
    },
    {
      "id": {
        "sourceId": 1,
        "targetId": 11
      },
      "negated": false
    },
    {
      "id": {
        "sourceId": 1,
        "targetId": 12
      },
      "negated": false
    },
    {
      "id": {
        "sourceId": 18,
        "targetId": 5
      },
      "negated": false
    },
    {
      "id": {
        "sourceId": 2,
        "targetId": 18
      },
      "negated": false
    },
    {
      "id": {
        "sourceId": 19,
        "targetId": 5
      },
      "negated": false
    }
  ]
}
