{
  "apiVersion": "graphical/v1",
  "atoms": [
    {
      "id": 0,
      "name": "at-risk",
      "description": "The patient has been at risk for respiratory illness.",
      "assumption": 3,
      "position": {
        "x": 300,
        "y": 100
      }
    },
    {
      "id": 1,
      "name": "corona",
      "description": "The patient has been infected by the coronavirus.",
      "assumption": 3,
      "position": {
        "x": 500,
        "y": 100
      }
    },
    {
      "id": 2,
      "name": "influenza",
      "description": "The patient has been infected by the influenza virus.",
      "assumption": 3,
      "position": {
        "x": 700,
        "y": 100
      }
    },
    {
      "id": 3,
      "name": "covid",
      "description": "The patient has developed COVID.",
      "position": {
        "x": 500,
        "y": 300
      }
    },
    {
      "id": 4,
      "name": "flu",
      "description": "The patient has developed the flu.",
      "position": {
        "x": 700,
        "y": 300
      }
    },
    {
      "id": 5,
      "name": "fever",
      "description": "The patient has had a fever.",
      "position": {
        "x": 632,
        "y": 500
      }
    },
    {
      "id": 6,
      "name": "chills",
      "description": "The patient has experienced chills.",
      "position": {
        "x": 600,
        "y": 700
      }
    },
    {
      "id": 7,
      "name": "short-of-breath",
      "description": "The patient has been short of breath.",
      "position": {
        "x": 300,
        "y": 500
      }
    }
  ],
  "operators": [
    {
      "id": 8,
      "type": "conjunction",
      "position": {
        "x": 300,
        "y": 72
      }
    },
    {
      "id": 9,
      "type": "conjunction",
      "position": {
        "x": 500,
        "y": 72
      }
    },
    {
      "id": 10,
      "type": "conjunction",
      "position": {
        "x": 700,
        "y": 72
      }
    },
    {
      "id": 11,
      "type": "conjunction",
      "position": {
        "x": 468,
        "y": 272
      }
    },
    {
      "id": 12,
      "type": "conjunction",
      "position": {
        "x": 668,
        "y": 272
      }
    },
    {
      "id": 13,
      "type": "conjunction",
      "position": {
        "x": 568,
        "y": 472
      }
    },
    {
      "id": 14,
      "type": "conjunction",
      "position": {
        "x": 568,
        "y": 672
      }
    },
    {
      "id": 15,
      "type": "conjunction",
      "position": {
        "x": 268,
        "y": 472
      }
    },
    {
      "id": 16,
      "type": "conjunction",
      "position": {
        "x": 632,
        "y": 672
      }
    },
    {
      "id": 17,
      "type": "conjunction",
      "position": {
        "x": 632,
        "y": 472
      }
    },
    {
      "id": 18,
      "type": "conjunction",
      "position": {
        "x": 696,
        "y": 472
      }
    },
    {
      "id": 19,
      "type": "conjunction",
      "position": {
        "x": 732,
        "y": 272
      }
    },
    {
      "id": 20,
      "type": "conjunction",
      "position": {
        "x": 532,
        "y": 272
      }
    },
    {
      "id": 21,
      "type": "conjunction",
      "position": {
        "x": 332,
        "y": 472
      }
    }
  ],
  "connections": [
    {
      "id": {
        "sourceId": 8,
        "targetId": 0
      },
      "negated": false
    },
    {
      "id": {
        "sourceId": 9,
        "targetId": 1
      },
      "negated": false
    },
    {
      "id": {
        "sourceId": 10,
        "targetId": 2
      },
      "negated": false
    },
    {
      "id": {
        "sourceId": 11,
        "targetId": 3
      },
      "negated": false
    },
    {
      "id": {
        "sourceId": 12,
        "targetId": 4
      },
      "negated": false
    },
    {
      "id": {
        "sourceId": 13,
        "targetId": 5
      },
      "negated": false
    },
    {
      "id": {
        "sourceId": 14,
        "targetId": 6
      },
      "negated": false
    },
    {
      "id": {
        "sourceId": 15,
        "targetId": 7
      },
      "negated": false
    },
    {
      "id": {
        "sourceId": 5,
        "targetId": 14
      },
      "negated": false
    },
    {
      "id": {
        "sourceId": 16,
        "targetId": 6
      },
      "negated": false
    },
    {
      "id": {
        "sourceId": 3,
        "targetId": 13
      },
      "negated": false
    },
    {
      "id": {
        "sourceId": 17,
        "targetId": 5
      },
      "negated": false
    },
    {
      "id": {
        "sourceId": 4,
        "targetId": 17
      },
      "negated": false
    },
    {
      "id": {
        "sourceId": 18,
        "targetId": 5
      },
      "negated": false
    },
    {
      "id": {
        "sourceId": 2,
        "targetId": 12
      },
      "negated": false
    },
    {
      "id": {
        "sourceId": 19,
        "targetId": 4
      },
      "negated": false
    },
    {
      "id": {
        "sourceId": 1,
        "targetId": 11
      },
      "negated": false
    },
    {
      "id": {
        "sourceId": 20,
        "targetId": 3
      },
      "negated": false
    },
    {
      "id": {
        "sourceId": 3,
        "targetId": 15
      },
      "negated": false
    },
    {
      "id": {
        "sourceId": 21,
        "targetId": 7
      },
      "negated": false
    },
    {
      "id": {
        "sourceId": 0,
        "targetId": 15
      },
      "negated": false
    }
  ]
}
